application/models/release/leelaz_opencl_tuning
0;XgemmBatched;256;256;256;16; -DKWG=32 -DKWI=2 -DMDIMA=8 -DMDIMC=8 -DMWG=32 -DNDIMB=8 -DNDIMC=8 -DNWG=32 -DSA=1 -DSB=1 -DSTRM=0 -DSTRN=0 -DVWM=4 -DVWN=4;OpenCL: Intel Intel(R) HD Graphics 5500 BroadWell U-Processor GT2 @ 1000MHz
